{
  "$schema": "https://hopcoder.dev/desktop-theme.json",
  "name": "HopCoderX",
  "id": "hopcoderx",
  "light": {
    "seeds": {
      "neutral": "#d4cfc2",
      "primary": "#C9A227",
      "success": "#3d9a57",
      "warning": "#b8890f",
      "error": "#d1383d",
      "info": "#318795",
      "interactive": "#C9A227",
      "diffAdd": "#3d9a57",
      "diffDelete": "#d1383d"
    },
    "overrides": {
      "background-base": "#f8f6f0",
      "background-weak": "#f3f0e8",
      "background-strong": "#eae6dc",
      "background-stronger": "#faf8f4",
      "border-weak-base": "#e0dbd0",
      "border-weak-hover": "#d4cfc2",
      "border-weak-active": "#c5bfb0",
      "border-weak-selected": "#c5bfb0",
      "border-weak-disabled": "#eae6dc",
      "border-weak-focus": "#C9A227",
      "border-base": "#c5bfb0",
      "border-hover": "#afa89a",
      "border-active": "#938d7f",
      "border-selected": "#C9A227",
      "border-disabled": "#e0dbd0",
      "border-focus": "#C9A227",
      "border-strong-base": "#938d7f",
      "border-strong-hover": "#726c60",
      "border-strong-active": "#5c574d",
      "border-strong-selected": "#C9A227",
      "border-strong-disabled": "#c5bfb0",
      "border-strong-focus": "#C9A227",
      "surface-diff-add-base": "#d5e5d5",
      "surface-diff-delete-base": "#f7d8db",
      "surface-diff-hidden-base": "#eae6dc",
      "text-base": "#141414",
      "text-invert-strong": "#f8f6f0",
      "text-weak": "#726c60",
      "text-strong": "#000000",
      "syntax-string": "#3d9a57",
      "syntax-primitive": "#d1383d",
      "syntax-property": "#9a7209",
      "syntax-type": "#b8890f",
      "syntax-constant": "#726c60",
      "syntax-info": "#938d7f",
      "markdown-heading": "#C9A227",
      "markdown-text": "#141414",
      "markdown-link": "#C9A227",
      "markdown-link-text": "#318795",
      "markdown-code": "#938d7f",
      "markdown-block-quote": "#141414",
      "markdown-emph": "#b8890f",
      "markdown-strong": "#C9A227",
      "markdown-horizontal-rule": "#c5bfb0",
      "markdown-list-item": "#141414",
      "markdown-list-enumeration": "#318795",
      "markdown-image": "#C9A227",
      "markdown-image-text": "#318795",
      "markdown-code-block": "#141414"
    }
  },
  "dark": {
    "seeds": {
      "neutral": "#080808",
      "primary": "#C9A227",
      "success": "#7fd88f",
      "warning": "#F0C040",
      "error": "#e06c75",
      "info": "#56b6c2",
      "interactive": "#C9A227",
      "diffAdd": "#7fd88f",
      "diffDelete": "#e06c75"
    },
    "overrides": {
      "background-base": "#080808",
      "background-weak": "#0e0e10",
      "background-strong": "#050505",
      "background-stronger": "#030303",
      "border-weak-base": "#1c1c1f",
      "border-weak-hover": "#232326",
      "border-weak-active": "#2b2b2f",
      "border-weak-selected": "#C9A227",
      "border-weak-disabled": "#161618",
      "border-weak-focus": "#C9A227",
      "border-base": "#2b2b2f",
      "border-hover": "#363639",
      "border-active": "#4e4e54",
      "border-selected": "#C9A227",
      "border-disabled": "#1c1c1f",
      "border-focus": "#C9A227",
      "border-strong-base": "#4e4e54",
      "border-strong-hover": "#5a5a60",
      "border-strong-active": "#6a6a70",
      "border-strong-selected": "#F0C040",
      "border-strong-disabled": "#232326",
      "border-strong-focus": "#C9A227",
      "surface-diff-add-base": "#0d2818",
      "surface-diff-delete-base": "#2d1520",
      "surface-diff-hidden-base": "#0e0e10",
      "text-base": "#F2EFE8",
      "text-weak": "#8c8c98",
      "text-strong": "#FFFFFF",
      "syntax-string": "#7fd88f",
      "syntax-primitive": "#e06c75",
      "syntax-property": "#F0C040",
      "syntax-type": "#F0C040",
      "syntax-constant": "#8c8c98",
      "syntax-info": "#636370",
      "markdown-heading": "#C9A227",
      "markdown-text": "#F2EFE8",
      "markdown-link": "#C9A227",
      "markdown-link-text": "#56b6c2",
      "markdown-code": "#8c8c98",
      "markdown-block-quote": "#F0C040",
      "markdown-emph": "#F0C040",
      "markdown-strong": "#C9A227",
      "markdown-horizontal-rule": "#363639",
      "markdown-list-item": "#F2EFE8",
      "markdown-list-enumeration": "#56b6c2",
      "markdown-image": "#C9A227",
      "markdown-image-text": "#56b6c2",
      "markdown-code-block": "#F2EFE8"
    }
  }
}
