{
  "$schema": "https://hopcoder.dev/desktop-theme.json",
  "name": "Catppuccin",
  "id": "catppuccin",
  "light": {
    "seeds": {
      "neutral": "#f5e0dc",
      "primary": "#7287fd",
      "success": "#40a02b",
      "warning": "#df8e1d",
      "error": "#d20f39",
      "info": "#04a5e5",
      "interactive": "#7287fd",
      "diffAdd": "#a6d189",
      "diffDelete": "#e78284"
    },
    "overrides": {
      "background-base": "#f5e0dc",
      "background-weak": "#f2d8d4",
      "background-strong": "#f9e8e4",
      "background-stronger": "#fdeeee",
      "border-weak-base": "#e0cfd3",
      "border-weak-hover": "#d6c4c8",
      "border-weak-active": "#cdb9be",
      "border-weak-selected": "#c2aeb4",
      "border-weak-disabled": "#fbeff2",
      "border-weak-focus": "#c7b4ba",
      "border-base": "#bca6b2",
      "border-hover": "#b19ca8",
      "border-active": "#a6929e",
      "border-selected": "#9a8894",
      "border-disabled": "#f3e4e7",
      "border-focus": "#ab97a1",
      "border-strong-base": "#83677f",
      "border-strong-hover": "#775b73",
      "border-strong-active": "#6b5068",
      "border-strong-selected": "#5f465d",
      "border-strong-disabled": "#d9c5cf",
      "border-strong-focus": "#714f66",
      "surface-diff-add-base": "#edf5e6",
      "surface-diff-delete-base": "#fde1e3",
      "surface-diff-hidden-base": "#e4e2f6",
      "text-base": "#4c4f69",
      "text-weak": "#6c6f85",
      "text-strong": "#1f1f2a",
      "syntax-string": "#40a02b",
      "syntax-primitive": "#d20f39",
      "syntax-property": "#7287fd",
      "syntax-type": "#df8e1d",
      "syntax-constant": "#04a5e5",
      "syntax-info": "#04a5e5",
      "markdown-heading": "#7287fd",
      "markdown-text": "#4c4f69",
      "markdown-link": "#7287fd",
      "markdown-link-text": "#04a5e5",
      "markdown-code": "#40a02b",
      "markdown-block-quote": "#df8e1d",
      "markdown-emph": "#df8e1d",
      "markdown-strong": "#d20f39",
      "markdown-horizontal-rule": "#d4c5cf",
      "markdown-list-item": "#7287fd",
      "markdown-list-enumeration": "#04a5e5",
      "markdown-image": "#7287fd",
      "markdown-image-text": "#04a5e5",
      "markdown-code-block": "#7287fd"
    }
  },
  "dark": {
    "seeds": {
      "neutral": "#1e1e2e",
      "primary": "#b4befe",
      "success": "#a6d189",
      "warning": "#f4b8e4",
      "error": "#f38ba8",
      "info": "#89dceb",
      "interactive": "#b4befe",
      "diffAdd": "#94e2d5",
      "diffDelete": "#f38ba8"
    },
    "overrides": {
      "background-base": "#1e1e2e",
      "background-weak": "#211f31",
      "background-strong": "#1c1c29",
      "background-stronger": "#191926",
      "border-weak-base": "#35324a",
      "border-weak-hover": "#393655",
      "border-weak-active": "#403c61",
      "border-weak-selected": "#47436d",
      "border-weak-disabled": "#141426",
      "border-weak-focus": "#3d3a63",
      "border-base": "#4a4763",
      "border-hover": "#524f70",
      "border-active": "#5a577d",
      "border-selected": "#625f8a",
      "border-disabled": "#1b1a2c",
      "border-focus": "#575379",
      "border-strong-base": "#6e6a8c",
      "border-strong-hover": "#787497",
      "border-strong-active": "#8380a2",
      "border-strong-selected": "#8d8bad",
      "border-strong-disabled": "#232237",
      "border-strong-focus": "#7b779b",
      "surface-diff-add-base": "#1d2c30",
      "surface-diff-delete-base": "#2c1f2a",
      "surface-diff-hidden-base": "#232538",
      "text-base": "#cdd6f4",
      "text-weak": "#a6adc8",
      "text-strong": "#f4f2ff",
      "syntax-string": "#a6e3a1",
      "syntax-primitive": "#f38ba8",
      "syntax-property": "#b4befe",
      "syntax-type": "#f9e2af",
      "syntax-constant": "#89dceb",
      "syntax-info": "#89dceb",
      "markdown-heading": "#b4befe",
      "markdown-text": "#cdd6f4",
      "markdown-link": "#b4befe",
      "markdown-link-text": "#89dceb",
      "markdown-code": "#a6e3a1",
      "markdown-block-quote": "#f9e2af",
      "markdown-emph": "#f9e2af",
      "markdown-strong": "#f38ba8",
      "markdown-horizontal-rule": "#2e2d45",
      "markdown-list-item": "#b4befe",
      "markdown-list-enumeration": "#89dceb",
      "markdown-image": "#b4befe",
      "markdown-image-text": "#89dceb",
      "markdown-code-block": "#cdd6f4"
    }
  }
}
