{
  "$schema": "https://hopcoder.dev/desktop-theme.json",
  "name": "Carbonfox",
  "id": "carbonfox",
  "light": {
    "seeds": {
      "neutral": "#8e8e8e",
      "primary": "#0072c3",
      "success": "#198038",
      "warning": "#f1c21b",
      "error": "#da1e28",
      "info": "#0043ce",
      "interactive": "#0f62fe",
      "diffAdd": "#198038",
      "diffDelete": "#da1e28"
    },
    "overrides": {
      "background-base": "#ffffff",
      "background-weak": "#f4f4f4",
      "background-strong": "#e8e8e8",
      "background-stronger": "#dcdcdc",
      "surface-raised-strong": "#ffffff",
      "surface-raised-stronger": "#ffffff",
      "surface-float-base": "#161616",
      "surface-float-base-hover": "#262626",
      "text-base": "#161616",
      "text-weak": "#525252",
      "text-strong": "#000000",
      "syntax-string": "#198038",
      "syntax-primitive": "#da1e28",
      "syntax-property": "#0043ce",
      "syntax-type": "#007d79",
      "syntax-constant": "#6929c4",
      "syntax-keyword": "#525252",
      "syntax-info": "#0043ce",
      "markdown-heading": "#0043ce",
      "markdown-text": "#161616",
      "markdown-link": "#0043ce",
      "markdown-link-text": "#0072c3",
      "markdown-code": "#198038",
      "markdown-block-quote": "#525252",
      "markdown-emph": "#6929c4",
      "markdown-strong": "#161616",
      "markdown-horizontal-rule": "#c6c6c6",
      "markdown-list-item": "#0072c3",
      "markdown-list-enumeration": "#0072c3",
      "markdown-image": "#0043ce",
      "markdown-image-text": "#0072c3",
      "markdown-code-block": "#393939"
    }
  },
  "dark": {
    "seeds": {
      "neutral": "#393939",
      "primary": "#33b1ff",
      "success": "#42be65",
      "warning": "#f1c21b",
      "error": "#ff8389",
      "info": "#78a9ff",
      "interactive": "#4589ff",
      "diffAdd": "#42be65",
      "diffDelete": "#ff8389"
    },
    "overrides": {
      "background-base": "#161616",
      "background-weak": "#262626",
      "background-strong": "#0d0d0d",
      "background-stronger": "#000000",
      "surface-raised-base": "#1c1c1c",
      "surface-raised-base-hover": "#262626",
      "surface-raised-strong": "#262626",
      "surface-raised-strong-hover": "#303030",
      "surface-raised-stronger": "#303030",
      "surface-raised-stronger-hover": "#393939",
      "surface-raised-stronger-non-alpha": "#303030",
      "surface-float-base": "#0d0d0d",
      "surface-float-base-hover": "#1a1a1a",
      "surface-inset-base": "#0d0d0d",
      "surface-inset-strong": "#000000",
      "surface-base": "#1e1e1e",
      "surface-base-hover": "#262626",
      "surface-diff-add-base": "#0e3a22",
      "surface-diff-delete-base": "#4d1a1f",
      "input-base": "#262626",
      "input-hover": "#303030",
      "button-secondary-base": "#393939",
      "button-secondary-hover": "#4c4c4c",
      "border-weak-base": "#393939",
      "border-weak-hover": "#4c4c4c",
      "border-base": "#525252",
      "border-hover": "#636363",
      "border-strong-base": "#6f6f6f",
      "text-base": "#f2f4f8",
      "text-weak": "#8d8d8d",
      "text-weaker": "#6f6f6f",
      "text-strong": "#ffffff",
      "icon-base": "#8d8d8d",
      "icon-weak-base": "#6f6f6f",
      "syntax-string": "#42be65",
      "syntax-primitive": "#ff8389",
      "syntax-property": "#78a9ff",
      "syntax-type": "#08bdba",
      "syntax-constant": "#be95ff",
      "syntax-keyword": "#8d8d8d",
      "syntax-info": "#78a9ff",
      "markdown-heading": "#82cfff",
      "markdown-text": "#f2f4f8",
      "markdown-link": "#78a9ff",
      "markdown-link-text": "#33b1ff",
      "markdown-code": "#42be65",
      "markdown-block-quote": "#8d8d8d",
      "markdown-emph": "#be95ff",
      "markdown-strong": "#ffffff",
      "markdown-horizontal-rule": "#393939",
      "markdown-list-item": "#33b1ff",
      "markdown-list-enumeration": "#33b1ff",
      "markdown-image": "#78a9ff",
      "markdown-image-text": "#33b1ff",
      "markdown-code-block": "#c6c6c6"
    }
  }
}
